Peach - Fresh,ut nulla sed accumsan felis ut at dolor quis odio consequat varius integer ac leo pellentesque ultrices mattis odio donec
Coffee Cup 8oz 5338cd,est quam pharetra magna ac consequat metus sapien ut nunc vestibulum ante ipsum primis
Tea - Black Currant,aenean auctor gravida sem praesent id massa id nisl venenatis lacinia aenean sit amet justo morbi ut odio cras mi
Puree - Mocha,mauris laoreet ut rhoncus aliquet pulvinar sed nisl nunc rhoncus dui vel sem sed sagittis nam
Cheese - Cambozola,est risus auctor sed tristique in tempus sit amet sem fusce consequat nulla nisl nunc nisl duis bibendum
Cookie Dough - Oatmeal Rasin,in est risus auctor sed tristique in tempus sit amet sem fusce consequat nulla nisl
"Pasta - Linguini, Dry",ante nulla justo aliquam quis turpis eget elit sodales scelerisque mauris sit
"Tarragon - Primerba, Paste",eu orci mauris lacinia sapien quis libero nullam sit amet
Juice - Orangina,habitasse platea dictumst aliquam augue quam sollicitudin vitae consectetuer eget rutrum at lorem integer tincidunt ante vel ipsum
"Pepsi - Diet, 355 Ml",etiam justo etiam pretium iaculis justo in hac habitasse platea dictumst etiam faucibus cursus urna
Sauce - Roasted Red Pepper,quisque arcu libero rutrum ac lobortis vel dapibus at diam nam tristique tortor
Quail - Jumbo,fermentum donec ut mauris eget massa tempor convallis nulla neque libero
"Loaf Pan - 2 Lb, Foil",dui vel sem sed sagittis nam congue risus semper porta
Kellogs Special K Cereal,elit proin interdum mauris non ligula pellentesque ultrices phasellus id sapien
"Trout - Rainbow, Fresh",ut at dolor quis odio consequat varius integer ac leo pellentesque ultrices mattis odio donec
Beer - Pilsner Urquell,odio in hac habitasse platea dictumst maecenas ut massa quis
Puree - Blackcurrant,ac leo pellentesque ultrices mattis odio donec vitae nisi nam ultrices libero non mattis pulvinar nulla
Bread Base - Goodhearth,posuere cubilia curae nulla dapibus dolor vel est donec odio justo sollicitudin ut suscipit a feugiat
Spinach - Packaged,ornare imperdiet sapien urna pretium nisl ut volutpat sapien arcu sed augue aliquam erat volutpat in congue etiam justo etiam
Ecolab - Hobart Washarm End Cap,rutrum at lorem integer tincidunt ante vel ipsum praesent blandit
Muffin Hinge Container 6,mattis nibh ligula nec sem duis aliquam convallis nunc proin at turpis
Table Cloth 72x144 White,cubilia curae nulla dapibus dolor vel est donec odio justo sollicitudin
"Sauce - Gravy, Au Jus, Mix",sit amet erat nulla tempus vivamus in felis eu sapien cursus vestibulum proin eu mi nulla ac
"Soup - Beef, Base Mix",dis parturient montes nascetur ridiculus mus etiam vel augue vestibulum rutrum rutrum neque aenean
Wine - Zinfandel California 2002,condimentum id luctus nec molestie sed justo pellentesque viverra pede ac diam cras pellentesque volutpat dui maecenas tristique est et
Cream - 10%,vivamus metus arcu adipiscing molestie hendrerit at vulputate vitae nisl aenean lectus pellentesque eget nunc
Wine - Magnotta - Pinot Gris Sr,ac diam cras pellentesque volutpat dui maecenas tristique est et tempus semper est quam pharetra magna ac consequat metus
Rice - Sushi,ultrices posuere cubilia curae donec pharetra magna vestibulum aliquet ultrices erat tortor sollicitudin mi
Cabbage - Red,gravida nisi at nibh in hac habitasse platea dictumst aliquam augue quam sollicitudin vitae consectetuer eget rutrum at lorem integer
Amaretto,curabitur in libero ut massa volutpat convallis morbi odio odio elementum eu interdum
"Sole - Dover, Whole, Fresh",ipsum primis in faucibus orci luctus et ultrices posuere cubilia
Wine - Chianti Classica Docg,vulputate elementum nullam varius nulla facilisi cras non velit nec nisi vulputate nonummy maecenas tincidunt
Wild Boar - Tenderloin,risus dapibus augue vel accumsan tellus nisi eu orci mauris
"Pasta - Rotini, Colour, Dry",turpis eget elit sodales scelerisque mauris sit amet eros suspendisse accumsan tortor quis turpis sed ante vivamus
"Pineapple - Canned, Rings",duis ac nibh fusce lacus purus aliquet at feugiat non pretium quis lectus suspendisse potenti in eleifend quam a odio
Filter - Coffee,sed vel enim sit amet nunc viverra dapibus nulla suscipit
Lettuce - Lolla Rosa,integer aliquet massa id lobortis convallis tortor risus dapibus augue
Wine - Casillero Del Diablo,ante ipsum primis in faucibus orci luctus et ultrices posuere cubilia curae nulla dapibus dolor vel est donec odio
Lettuce - Green Leaf,in hac habitasse platea dictumst morbi vestibulum velit id pretium iaculis diam erat fermentum justo nec condimentum
"Pasta - Cannelloni, Sheets, Fresh",sociis natoque penatibus et magnis dis parturient montes nascetur ridiculus mus etiam vel augue vestibulum rutrum rutrum neque aenean
Wine - Lamancha Do Crianza,sit amet consectetuer adipiscing elit proin interdum mauris non ligula pellentesque ultrices phasellus id sapien in sapien iaculis congue
Garam Masala Powder,nascetur ridiculus mus vivamus vestibulum sagittis sapien cum sociis natoque penatibus et magnis dis parturient montes nascetur
Ice Cream - Life Savers,libero convallis eget eleifend luctus ultricies eu nibh quisque id justo sit amet sapien dignissim vestibulum vestibulum ante ipsum
Ecolab - Medallion,mauris enim leo rhoncus sed vestibulum sit amet cursus id turpis integer aliquet massa id lobortis convallis tortor
Lettuce - Treviso,erat eros viverra eget congue eget semper rutrum nulla nunc purus phasellus
Ecolab - Medallion,ornare imperdiet sapien urna pretium nisl ut volutpat sapien arcu sed augue aliquam erat volutpat in
Tea - Herbal Sweet Dreams,vitae quam suspendisse potenti nullam porttitor lacus at turpis donec posuere metus vitae ipsum
Calaloo,lectus pellentesque at nulla suspendisse potenti cras in purus eu magna vulputate luctus
"Crush - Orange, 355ml",in hac habitasse platea dictumst aliquam augue quam sollicitudin vitae consectetuer eget rutrum at lorem integer tincidunt ante
Chocolate Bar - Smarties,ligula sit amet eleifend pede libero quis orci nullam molestie nibh in lectus pellentesque at nulla suspendisse potenti cras
Tofu - Firm,commodo vulputate justo in blandit ultrices enim lorem ipsum dolor sit amet consectetuer adipiscing elit proin interdum mauris non ligula
Sterno - Chafing Dish Fuel,ipsum ac tellus semper interdum mauris ullamcorper purus sit amet nulla quisque arcu libero rutrum ac
Creme De Menth - White,pellentesque volutpat dui maecenas tristique est et tempus semper est quam pharetra magna ac consequat metus sapien ut
Sprouts - Brussel,porta volutpat erat quisque erat eros viverra eget congue eget semper rutrum nulla nunc purus
"Tart Shells - Barquettes, Savory",turpis adipiscing lorem vitae mattis nibh ligula nec sem duis aliquam convallis nunc proin at turpis a pede posuere
"Juice - Clam, 46 Oz",bibendum morbi non quam nec dui luctus rutrum nulla tellus in sagittis dui vel
"Tortillas - Flour, 12",et ultrices posuere cubilia curae duis faucibus accumsan odio curabitur convallis duis consequat
Uniform Linen Charge,arcu sed augue aliquam erat volutpat in congue etiam justo etiam pretium iaculis justo in hac habitasse platea
"Chocolate - Pistoles, Lactee, Milk",lectus in quam fringilla rhoncus mauris enim leo rhoncus sed vestibulum sit amet cursus id turpis integer aliquet
Irish Cream - Baileys,nascetur ridiculus mus etiam vel augue vestibulum rutrum rutrum neque aenean auctor gravida sem praesent
Cheese - Shred Cheddar / Mozza,curabitur at ipsum ac tellus semper interdum mauris ullamcorper purus sit amet nulla quisque
Squash - Pepper,facilisi cras non velit nec nisi vulputate nonummy maecenas tincidunt lacus at velit vivamus vel nulla eget eros
Sauce Bbq Smokey,scelerisque mauris sit amet eros suspendisse accumsan tortor quis turpis sed ante vivamus tortor duis mattis
Wine - Maipo Valle Cabernet,aenean sit amet justo morbi ut odio cras mi pede malesuada in imperdiet et commodo vulputate justo in blandit ultrices
Versatainer Nc - 888,suspendisse potenti nullam porttitor lacus at turpis donec posuere metus vitae ipsum aliquam non
Mushroom - Lg - Cello,eros vestibulum ac est lacinia nisi venenatis tristique fusce congue diam id ornare imperdiet sapien urna
Puff Pastry - Slab,augue luctus tincidunt nulla mollis molestie lorem quisque ut erat curabitur
Bread - French Baquette,diam erat fermentum justo nec condimentum neque sapien placerat ante nulla justo aliquam quis turpis eget
"Pasta - Penne, Lisce, Dry",id lobortis convallis tortor risus dapibus augue vel accumsan tellus nisi eu orci mauris lacinia sapien quis
Pastry - Chocolate Marble Tea,libero non mattis pulvinar nulla pede ullamcorper augue a suscipit nulla elit ac nulla sed vel enim
Gatorade - Fruit Punch,blandit mi in porttitor pede justo eu massa donec dapibus duis
Broom And Broom Rack White,in tempor turpis nec euismod scelerisque quam turpis adipiscing lorem vitae mattis nibh ligula nec sem duis aliquam
"Tomatoes - Vine Ripe, Yellow",ligula nec sem duis aliquam convallis nunc proin at turpis a pede posuere nonummy integer non velit
Coffee - Cafe Moreno,neque libero convallis eget eleifend luctus ultricies eu nibh quisque id justo sit
"Lentils - Red, Dry",potenti cras in purus eu magna vulputate luctus cum sociis natoque penatibus et magnis dis parturient
Crab - Meat,nec nisi volutpat eleifend donec ut dolor morbi vel lectus in
Fuji Apples,convallis tortor risus dapibus augue vel accumsan tellus nisi eu orci mauris lacinia sapien
Sobe - Orange Carrot,ut odio cras mi pede malesuada in imperdiet et commodo
Carbonated Water - Blackcherry,sapien a libero nam dui proin leo odio porttitor id consequat in consequat ut nulla sed accumsan felis ut at
"Bread - Pumpernickle, Rounds",erat curabitur gravida nisi at nibh in hac habitasse platea dictumst aliquam augue quam sollicitudin vitae consectetuer eget rutrum
Pepper - Cubanelle,justo in blandit ultrices enim lorem ipsum dolor sit amet consectetuer adipiscing elit proin interdum mauris non ligula pellentesque ultrices
Appetizer - Assorted Box,consequat in consequat ut nulla sed accumsan felis ut at dolor quis odio consequat varius integer ac
Bread - Sour Sticks With Onion,felis sed lacus morbi sem mauris laoreet ut rhoncus aliquet pulvinar sed nisl nunc rhoncus dui vel sem
"Bread - Bagels, Mini",posuere cubilia curae donec pharetra magna vestibulum aliquet ultrices erat tortor
Chivas Regal - 12 Year Old,sapien in sapien iaculis congue vivamus metus arcu adipiscing molestie hendrerit at vulputate vitae
Garam Marsala,ipsum primis in faucibus orci luctus et ultrices posuere cubilia curae donec pharetra magna
Cheese - Brick With Pepper,sed accumsan felis ut at dolor quis odio consequat varius integer
Cucumber - Pickling Ontario,odio donec vitae nisi nam ultrices libero non mattis pulvinar nulla pede ullamcorper augue a suscipit nulla
Croissants Thaw And Serve,risus auctor sed tristique in tempus sit amet sem fusce consequat nulla nisl nunc nisl duis bibendum felis sed
Lettuce - Radicchio,nulla nisl nunc nisl duis bibendum felis sed interdum venenatis turpis enim blandit
Food Colouring - Blue,aliquet ultrices erat tortor sollicitudin mi sit amet lobortis sapien sapien non mi integer ac
"Trout - Hot Smkd, Dbl Fillet",in tempus sit amet sem fusce consequat nulla nisl nunc nisl
Triple Sec - Mcguinness,in tempor turpis nec euismod scelerisque quam turpis adipiscing lorem vitae
Creamers - 10%,nunc nisl duis bibendum felis sed interdum venenatis turpis enim
"Pork - Back, Long Cut, Boneless",praesent blandit nam nulla integer pede justo lacinia eget tincidunt
Wine - Spumante Bambino White,volutpat convallis morbi odio odio elementum eu interdum eu tincidunt in leo maecenas pulvinar lobortis est phasellus
Sugar - Cubes,orci luctus et ultrices posuere cubilia curae duis faucibus accumsan odio curabitur convallis duis consequat dui nec
Crab - Meat,turpis a pede posuere nonummy integer non velit donec diam neque vestibulum eget vulputate ut
Venison - Liver,ut suscipit a feugiat et eros vestibulum ac est lacinia nisi venenatis tristique
Pepper - Gypsy Pepper,vivamus vestibulum sagittis sapien cum sociis natoque penatibus et magnis dis
Beer - Muskoka Cream Ale,in felis eu sapien cursus vestibulum proin eu mi nulla
Sauce Bbq Smokey,sapien sapien non mi integer ac neque duis bibendum morbi
Cheese - Brie Roitelet,in consequat ut nulla sed accumsan felis ut at dolor quis odio consequat varius integer ac leo
Cheese - Stilton,bibendum imperdiet nullam orci pede venenatis non sodales sed tincidunt
Scallops - 20/30,consectetuer adipiscing elit proin risus praesent lectus vestibulum quam sapien varius
Alize Sunset,metus arcu adipiscing molestie hendrerit at vulputate vitae nisl aenean lectus pellentesque eget nunc donec quis orci
Island Oasis - Wildberry,pede morbi porttitor lorem id ligula suspendisse ornare consequat lectus in est
Shrimp - Tiger 21/25,suscipit a feugiat et eros vestibulum ac est lacinia nisi venenatis tristique fusce congue diam id ornare
"Fish - Halibut, Cold Smoked",a feugiat et eros vestibulum ac est lacinia nisi venenatis tristique fusce congue diam id ornare imperdiet sapien
Soup - Base Broth Beef,rhoncus aliquam lacus morbi quis tortor id nulla ultrices aliquet maecenas leo odio condimentum id luctus nec molestie sed
"Sauce - Bernaise, Mix",amet sapien dignissim vestibulum vestibulum ante ipsum primis in faucibus orci luctus et ultrices posuere cubilia curae nulla dapibus dolor
Ham - Cooked,vulputate vitae nisl aenean lectus pellentesque eget nunc donec quis orci eget orci vehicula condimentum curabitur
Bagel - Everything,in hac habitasse platea dictumst aliquam augue quam sollicitudin vitae consectetuer eget rutrum at lorem integer tincidunt ante vel
"Beans - Navy, Dry",ac nibh fusce lacus purus aliquet at feugiat non pretium quis lectus suspendisse potenti in eleifend quam a odio
Filter - Coffee,commodo vulputate justo in blandit ultrices enim lorem ipsum dolor sit
Lamb - Rack,mauris ullamcorper purus sit amet nulla quisque arcu libero rutrum ac lobortis
Quinoa,a suscipit nulla elit ac nulla sed vel enim sit amet nunc
Apricots - Halves,non mattis pulvinar nulla pede ullamcorper augue a suscipit nulla elit ac nulla sed vel
Bread - Pain Au Liat X12,pede malesuada in imperdiet et commodo vulputate justo in blandit ultrices enim lorem
Shrimp - 150 - 250,lacinia erat vestibulum sed magna at nunc commodo placerat praesent blandit
"Crush - Orange, 355ml",nam ultrices libero non mattis pulvinar nulla pede ullamcorper augue a suscipit nulla elit
Gherkin,at nunc commodo placerat praesent blandit nam nulla integer pede justo
Nantucket Apple Juice,eu sapien cursus vestibulum proin eu mi nulla ac enim in tempor turpis nec euismod scelerisque quam
"Veal - Insides, Grains",non lectus aliquam sit amet diam in magna bibendum imperdiet nullam orci pede venenatis non sodales sed tincidunt eu
Pork - Inside,sem fusce consequat nulla nisl nunc nisl duis bibendum felis sed interdum venenatis turpis enim blandit mi
Lobster - Live,tellus nisi eu orci mauris lacinia sapien quis libero nullam sit amet turpis elementum ligula vehicula consequat
Piping Jelly - All Colours,lacus curabitur at ipsum ac tellus semper interdum mauris ullamcorper purus sit
Five Alive Citrus,justo in hac habitasse platea dictumst etiam faucibus cursus urna
Fond - Chocolate,porta volutpat erat quisque erat eros viverra eget congue eget semper rutrum nulla nunc
"Chocolate - Pistoles, Lactee, Milk",augue aliquam erat volutpat in congue etiam justo etiam pretium iaculis justo
Island Oasis - Raspberry,volutpat convallis morbi odio odio elementum eu interdum eu tincidunt in leo maecenas pulvinar lobortis est phasellus sit amet erat
"Liners - Banana, Paper",interdum eu tincidunt in leo maecenas pulvinar lobortis est phasellus sit amet erat nulla
"Lamb - Pieces, Diced",aliquet massa id lobortis convallis tortor risus dapibus augue vel accumsan tellus
"Pepper - Black, Ground",metus aenean fermentum donec ut mauris eget massa tempor convallis nulla neque libero convallis eget eleifend luctus ultricies eu nibh
Wine - Casablanca Valley,rhoncus dui vel sem sed sagittis nam congue risus semper porta volutpat quam pede lobortis ligula sit amet eleifend pede
"Chilli Paste, Sambal Oelek",aliquet at feugiat non pretium quis lectus suspendisse potenti in eleifend quam a odio
Lettuce - Lolla Rosa,morbi porttitor lorem id ligula suspendisse ornare consequat lectus in est risus auctor
"Appetizer - Mini Egg Roll, Shrimp",egestas metus aenean fermentum donec ut mauris eget massa tempor convallis nulla neque libero convallis eget eleifend
Butter - Pod,condimentum id luctus nec molestie sed justo pellentesque viverra pede ac diam cras pellentesque volutpat dui maecenas tristique
Juice - Lemon,donec diam neque vestibulum eget vulputate ut ultrices vel augue vestibulum ante ipsum primis in faucibus orci luctus
Table Cloth 62x114 White,tellus semper interdum mauris ullamcorper purus sit amet nulla quisque arcu libero
Tuna - Sushi Grade,nulla ut erat id mauris vulputate elementum nullam varius nulla facilisi cras non velit nec nisi vulputate
Cookie Chocolate Chip With,donec quis orci eget orci vehicula condimentum curabitur in libero ut massa
Kale - Red,porttitor lorem id ligula suspendisse ornare consequat lectus in est risus
Energy Drink - Franks Original,nulla ultrices aliquet maecenas leo odio condimentum id luctus nec molestie sed justo pellentesque viverra pede ac
Squash - Guords,ut blandit non interdum in ante vestibulum ante ipsum primis in faucibus orci luctus et ultrices posuere cubilia curae duis
"Cheese - Mozzarella, Buffalo",aliquam quis turpis eget elit sodales scelerisque mauris sit amet eros suspendisse accumsan tortor quis turpis sed ante vivamus
Sage - Ground,duis consequat dui nec nisi volutpat eleifend donec ut dolor morbi vel
Remy Red,urna pretium nisl ut volutpat sapien arcu sed augue aliquam erat volutpat in congue etiam justo etiam pretium iaculis
Bread - Pain Au Liat X12,purus phasellus in felis donec semper sapien a libero nam dui
Table Cloth 81x81 Colour,adipiscing molestie hendrerit at vulputate vitae nisl aenean lectus pellentesque
Lime Cordial - Roses,justo in hac habitasse platea dictumst etiam faucibus cursus urna ut tellus nulla ut erat id mauris
Wild Boar - Tenderloin,eleifend quam a odio in hac habitasse platea dictumst maecenas ut massa quis augue luctus tincidunt nulla
Wine - Barossa Valley Estate,suscipit nulla elit ac nulla sed vel enim sit amet nunc viverra dapibus nulla
Garam Marsala,lacinia aenean sit amet justo morbi ut odio cras mi pede malesuada in imperdiet et commodo vulputate justo in blandit
Pectin,urna ut tellus nulla ut erat id mauris vulputate elementum nullam varius nulla facilisi cras non velit nec nisi vulputate
Soup - Campbells Bean Medley,ante vivamus tortor duis mattis egestas metus aenean fermentum donec
Lid Tray - 16in Dome,non velit donec diam neque vestibulum eget vulputate ut ultrices vel augue
Cleaner - Lime Away,primis in faucibus orci luctus et ultrices posuere cubilia curae duis faucibus accumsan odio
"Tomatoes - Vine Ripe, Red",nisl duis bibendum felis sed interdum venenatis turpis enim blandit mi in porttitor pede justo eu massa donec dapibus duis
"Beets - Candy Cane, Organic",dictumst etiam faucibus cursus urna ut tellus nulla ut erat id mauris vulputate elementum nullam varius nulla
"Tortillas - Flour, 10",eleifend pede libero quis orci nullam molestie nibh in lectus pellentesque at nulla suspendisse potenti cras in purus eu magna
"Coconut - Shredded, Unsweet",volutpat quam pede lobortis ligula sit amet eleifend pede libero quis orci nullam molestie nibh in lectus pellentesque at nulla
Cheese - Colby,integer ac neque duis bibendum morbi non quam nec dui luctus rutrum nulla tellus in
"Sparkling Wine - Rose, Freixenet",nec sem duis aliquam convallis nunc proin at turpis a pede posuere
Glaze - Clear,sit amet consectetuer adipiscing elit proin risus praesent lectus vestibulum quam sapien varius ut blandit non interdum in
Wine - Redchard Merritt,vestibulum vestibulum ante ipsum primis in faucibus orci luctus et
Onions - Green,ut tellus nulla ut erat id mauris vulputate elementum nullam varius nulla facilisi
Beef Striploin Aaa,vestibulum sed magna at nunc commodo placerat praesent blandit nam nulla integer pede
Wine - Cave Springs Dry Riesling,vestibulum ante ipsum primis in faucibus orci luctus et ultrices posuere cubilia curae nulla dapibus dolor vel est
Raspberries - Fresh,justo sit amet sapien dignissim vestibulum vestibulum ante ipsum primis
"Soup - Campbells, Lentil",ligula sit amet eleifend pede libero quis orci nullam molestie nibh in lectus pellentesque at nulla suspendisse potenti cras
Tomato - Plum With Basil,sed nisl nunc rhoncus dui vel sem sed sagittis nam congue risus semper porta volutpat
Cheese - Parmigiano Reggiano,platea dictumst maecenas ut massa quis augue luctus tincidunt nulla mollis molestie lorem quisque ut erat curabitur gravida nisi at
Cocktail Napkin Blue,vestibulum ante ipsum primis in faucibus orci luctus et ultrices posuere cubilia curae nulla
Compound - Mocha,ultrices posuere cubilia curae nulla dapibus dolor vel est donec odio justo sollicitudin ut suscipit
Gatorade - Xfactor Berry,at velit eu est congue elementum in hac habitasse platea dictumst morbi vestibulum velit id pretium iaculis diam erat
Bagels Poppyseed,mus etiam vel augue vestibulum rutrum rutrum neque aenean auctor gravida sem praesent id massa id nisl venenatis lacinia
Chevere Logs,velit donec diam neque vestibulum eget vulputate ut ultrices vel augue vestibulum ante
Bagel - Plain,semper porta volutpat quam pede lobortis ligula sit amet eleifend pede libero quis orci nullam molestie
"Beef - Tongue, Fresh",augue a suscipit nulla elit ac nulla sed vel enim sit amet nunc viverra dapibus nulla suscipit ligula in
Beer - True North Strong Ale,odio donec vitae nisi nam ultrices libero non mattis pulvinar nulla pede ullamcorper augue a suscipit nulla
Yoghurt Tubes,diam id ornare imperdiet sapien urna pretium nisl ut volutpat sapien arcu sed augue aliquam erat volutpat
"Lentils - Green, Dry",consectetuer eget rutrum at lorem integer tincidunt ante vel ipsum praesent blandit lacinia erat
Puree - Pear,id massa id nisl venenatis lacinia aenean sit amet justo morbi ut odio cras mi pede malesuada in imperdiet et
Apples - Sliced / Wedge,leo rhoncus sed vestibulum sit amet cursus id turpis integer aliquet massa
Chicken - Ground,fermentum justo nec condimentum neque sapien placerat ante nulla justo aliquam quis turpis eget elit sodales scelerisque mauris
"Napkin - Beverge, White 2 - Ply",vivamus tortor duis mattis egestas metus aenean fermentum donec ut mauris eget massa tempor convallis nulla neque libero
Daves Island Stinger,lorem quisque ut erat curabitur gravida nisi at nibh in hac habitasse platea dictumst aliquam augue
Cleaner - Pine Sol,pede justo eu massa donec dapibus duis at velit eu est congue elementum in hac habitasse
Pastry - Lemon Danish - Mini,vulputate nonummy maecenas tincidunt lacus at velit vivamus vel nulla eget
Pork - Sausage Casing,nam congue risus semper porta volutpat quam pede lobortis ligula sit amet eleifend pede libero quis orci nullam
Longos - Chicken Curried,vestibulum sed magna at nunc commodo placerat praesent blandit nam nulla integer pede justo lacinia eget
Potatoes - Pei 10 Oz,eget orci vehicula condimentum curabitur in libero ut massa volutpat convallis morbi odio odio elementum eu interdum
Onions - Pearl,vestibulum velit id pretium iaculis diam erat fermentum justo nec condimentum neque sapien placerat ante nulla justo aliquam quis
Wine - Balbach Riverside,eget nunc donec quis orci eget orci vehicula condimentum curabitur
Pate - Liver,est lacinia nisi venenatis tristique fusce congue diam id ornare imperdiet sapien urna pretium nisl ut volutpat
"Asparagus - White, Canned",ultricies eu nibh quisque id justo sit amet sapien dignissim vestibulum vestibulum ante ipsum primis in faucibus
"Nut - Pecan, Pieces",interdum eu tincidunt in leo maecenas pulvinar lobortis est phasellus sit
Lime Cordial - Roses,volutpat sapien arcu sed augue aliquam erat volutpat in congue etiam justo etiam pretium iaculis justo in hac habitasse platea
Muffin - Mix - Creme Brule 15l,diam neque vestibulum eget vulputate ut ultrices vel augue vestibulum
Beef - Prime Rib Aaa,sit amet consectetuer adipiscing elit proin interdum mauris non ligula pellentesque ultrices phasellus id sapien in sapien iaculis congue
Wine - German Riesling,in quis justo maecenas rhoncus aliquam lacus morbi quis tortor
Vinegar - Raspberry,mauris laoreet ut rhoncus aliquet pulvinar sed nisl nunc rhoncus dui vel sem sed sagittis nam congue risus semper
"Shrimp - 16/20, Iqf, Shell On",pede venenatis non sodales sed tincidunt eu felis fusce posuere felis sed lacus morbi
Soup - Cream Of Broccoli,montes nascetur ridiculus mus vivamus vestibulum sagittis sapien cum sociis natoque penatibus et magnis dis parturient montes nascetur ridiculus mus
"Pepper - Chillies, Crushed",magnis dis parturient montes nascetur ridiculus mus etiam vel augue vestibulum rutrum rutrum neque aenean auctor
Pastry - Carrot Muffin - Mini,vestibulum ante ipsum primis in faucibus orci luctus et ultrices posuere
Muffin Hinge 117n,auctor sed tristique in tempus sit amet sem fusce consequat
Vinegar - Rice,nibh fusce lacus purus aliquet at feugiat non pretium quis
"Coke - Diet, 355 Ml",est donec odio justo sollicitudin ut suscipit a feugiat et eros vestibulum ac est lacinia
Soup - Campbells Mac N Cheese,fusce consequat nulla nisl nunc nisl duis bibendum felis sed interdum venenatis turpis
Wine - Alicanca Vinho Verde,nunc donec quis orci eget orci vehicula condimentum curabitur in
Chips - Miss Vickies,eros suspendisse accumsan tortor quis turpis sed ante vivamus tortor duis mattis egestas
Bread - Rye,elementum nullam varius nulla facilisi cras non velit nec nisi vulputate nonummy maecenas
Oven Mitt - 13 Inch,quis turpis eget elit sodales scelerisque mauris sit amet eros suspendisse
