Flour - Chickpea,amet consectetuer adipiscing elit proin interdum mauris non ligula pellentesque ultrices phasellus id sapien in sapien iaculis congue vivamus
Eggs - Extra Large,sed augue aliquam erat volutpat in congue etiam justo etiam pretium iaculis justo in hac habitasse platea dictumst
Ham - Black Forest,convallis nulla neque libero convallis eget eleifend luctus ultricies eu
Appetizer - Crab And Brie,eros suspendisse accumsan tortor quis turpis sed ante vivamus tortor duis mattis egestas metus aenean fermentum
Bar Energy Chocchip,semper porta volutpat quam pede lobortis ligula sit amet eleifend pede libero quis orci nullam molestie nibh
Wine - Chablis 2003 Champs,lorem id ligula suspendisse ornare consequat lectus in est risus auctor sed tristique in tempus sit amet
Ice Cream Bar - Hageen Daz To,gravida nisi at nibh in hac habitasse platea dictumst aliquam augue quam sollicitudin vitae consectetuer eget
Pepper - Red Chili,risus auctor sed tristique in tempus sit amet sem fusce consequat nulla nisl nunc
Bar Special K,sit amet cursus id turpis integer aliquet massa id lobortis convallis tortor risus dapibus
Soap - Hand Soap,ac consequat metus sapien ut nunc vestibulum ante ipsum primis in faucibus orci luctus et ultrices posuere cubilia
Bread - 10 Grain Parisian,ligula vehicula consequat morbi a ipsum integer a nibh in quis justo maecenas rhoncus aliquam
"Fish - Artic Char, Cold Smoked",velit donec diam neque vestibulum eget vulputate ut ultrices vel augue vestibulum
Bagel - Everything,at turpis donec posuere metus vitae ipsum aliquam non mauris morbi non lectus aliquam sit amet diam in magna bibendum
Jolt Cola - Red Eye,at velit eu est congue elementum in hac habitasse platea dictumst morbi vestibulum velit id pretium
Eggplant Oriental,quis odio consequat varius integer ac leo pellentesque ultrices mattis odio donec vitae nisi nam
"Pasta - Orzo, Dry",elit sodales scelerisque mauris sit amet eros suspendisse accumsan tortor quis turpis sed ante vivamus tortor duis
Muffin Batt - Blueberry Passion,magnis dis parturient montes nascetur ridiculus mus vivamus vestibulum sagittis sapien
Yogurt - Assorted Pack,nibh in quis justo maecenas rhoncus aliquam lacus morbi quis tortor id nulla ultrices
"Mushroom - Shitake, Dry",justo nec condimentum neque sapien placerat ante nulla justo aliquam quis turpis eget elit sodales scelerisque mauris sit
Cookies - Amaretto,eros suspendisse accumsan tortor quis turpis sed ante vivamus tortor duis
"Glass - Wine, Plastic, Clear 5 Oz",vestibulum rutrum rutrum neque aenean auctor gravida sem praesent id
Egg Patty Fried,libero rutrum ac lobortis vel dapibus at diam nam tristique tortor eu pede
Muffin - Mix - Bran And Maple 15l,ac tellus semper interdum mauris ullamcorper purus sit amet nulla quisque arcu libero rutrum
Sauce - Soy Low Sodium - 3.87l,ut suscipit a feugiat et eros vestibulum ac est lacinia nisi venenatis tristique fusce congue diam id ornare imperdiet sapien
Stainless Steel Cleaner Vision,nisl aenean lectus pellentesque eget nunc donec quis orci eget orci vehicula condimentum curabitur in libero ut massa
"Tomatoes - Plum, Canned",sapien arcu sed augue aliquam erat volutpat in congue etiam justo etiam pretium iaculis justo in
Mints - Striped Red,duis consequat dui nec nisi volutpat eleifend donec ut dolor morbi vel lectus in quam fringilla
Mayonnaise - Individual Pkg,orci vehicula condimentum curabitur in libero ut massa volutpat convallis morbi odio odio elementum
Sobe - Lizard Fuel,pulvinar nulla pede ullamcorper augue a suscipit nulla elit ac nulla sed vel enim sit amet nunc viverra
Higashimaru Usukuchi Soy,platea dictumst etiam faucibus cursus urna ut tellus nulla ut erat id mauris vulputate elementum nullam varius nulla facilisi
Eggplant Oriental,placerat ante nulla justo aliquam quis turpis eget elit sodales scelerisque mauris sit amet eros suspendisse accumsan tortor quis turpis
"Halibut - Whole, Fresh",massa id lobortis convallis tortor risus dapibus augue vel accumsan tellus
Sauce - Marinara,vestibulum vestibulum ante ipsum primis in faucibus orci luctus et ultrices posuere cubilia curae nulla dapibus
Bread - Petit Baguette,fusce congue diam id ornare imperdiet sapien urna pretium nisl ut
Munchies Honey Sweet Trail Mix,est phasellus sit amet erat nulla tempus vivamus in felis
Turkey Leg With Drum And Thigh,lorem integer tincidunt ante vel ipsum praesent blandit lacinia erat vestibulum sed magna at nunc commodo placerat praesent blandit nam
"Ham - Smoked, Bone - In",in tempus sit amet sem fusce consequat nulla nisl nunc nisl
Bread Base - Toscano,vestibulum sagittis sapien cum sociis natoque penatibus et magnis dis parturient montes nascetur
Tamarind Paste,ultrices posuere cubilia curae nulla dapibus dolor vel est donec odio justo
Worcestershire Sauce,id nulla ultrices aliquet maecenas leo odio condimentum id luctus
Rosemary - Dry,consequat ut nulla sed accumsan felis ut at dolor quis odio consequat varius integer ac
Tamarillo,ultrices phasellus id sapien in sapien iaculis congue vivamus metus arcu adipiscing molestie hendrerit at vulputate vitae
Wine - Pinot Noir Mondavi Coastal,nisi at nibh in hac habitasse platea dictumst aliquam augue quam sollicitudin vitae consectetuer eget rutrum at lorem integer tincidunt
Wine - Tio Pepe Sherry Fino,ultrices posuere cubilia curae nulla dapibus dolor vel est donec odio justo sollicitudin ut suscipit a
Bread Base - Italian,id lobortis convallis tortor risus dapibus augue vel accumsan tellus nisi eu orci mauris lacinia sapien quis
"Fish - Artic Char, Cold Smoked",lorem id ligula suspendisse ornare consequat lectus in est risus
Wine - Montecillo Rioja Crianza,at nibh in hac habitasse platea dictumst aliquam augue quam sollicitudin vitae consectetuer
"Gingerale - Schweppes, 355 Ml",amet nunc viverra dapibus nulla suscipit ligula in lacus curabitur at ipsum ac tellus semper interdum
Lid - 0090 Clear,tellus in sagittis dui vel nisl duis ac nibh fusce
Pepper - Jalapeno,in porttitor pede justo eu massa donec dapibus duis at velit eu est congue
"Wine - Red, Harrow Estates, Cab",morbi non lectus aliquam sit amet diam in magna bibendum imperdiet nullam orci pede
Gatorade - Fruit Punch,parturient montes nascetur ridiculus mus vivamus vestibulum sagittis sapien cum sociis natoque penatibus et magnis dis
Rabbit - Saddles,nunc rhoncus dui vel sem sed sagittis nam congue risus
Pineapple - Golden,vestibulum vestibulum ante ipsum primis in faucibus orci luctus et ultrices posuere cubilia curae nulla dapibus
Bagel - Ched Chs Presliced,arcu adipiscing molestie hendrerit at vulputate vitae nisl aenean lectus pellentesque eget nunc donec
Juice - Happy Planet,curae nulla dapibus dolor vel est donec odio justo sollicitudin ut suscipit a
Mustard Prepared,massa volutpat convallis morbi odio odio elementum eu interdum eu tincidunt in leo maecenas pulvinar lobortis est
Bagels Poppyseed,nec nisi volutpat eleifend donec ut dolor morbi vel lectus in quam
Sprite - 355 Ml,convallis nulla neque libero convallis eget eleifend luctus ultricies eu nibh quisque id justo sit amet sapien dignissim vestibulum
"Mushroom - Shitake, Fresh",dolor sit amet consectetuer adipiscing elit proin risus praesent lectus vestibulum quam sapien varius ut blandit non interdum
Garam Masala Powder,lorem ipsum dolor sit amet consectetuer adipiscing elit proin interdum mauris non ligula pellentesque ultrices
Salmon - Fillets,nibh in lectus pellentesque at nulla suspendisse potenti cras in purus eu magna vulputate luctus cum sociis
