Puree - Blackcurrant,montes nascetur ridiculus mus etiam vel augue vestibulum rutrum rutrum
Tilapia - Fillets,interdum in ante vestibulum ante ipsum primis in faucibus orci luctus et ultrices posuere cubilia curae duis faucibus accumsan odio
Cape Capensis - Fillet,ante vestibulum ante ipsum primis in faucibus orci luctus et ultrices posuere cubilia curae duis faucibus accumsan
Broccoli - Fresh,turpis enim blandit mi in porttitor pede justo eu massa donec dapibus
Wine - Rosso Toscano Igt,eget massa tempor convallis nulla neque libero convallis eget eleifend luctus ultricies eu nibh quisque id justo
"Beef - Outside, Round",augue a suscipit nulla elit ac nulla sed vel enim sit amet nunc viverra dapibus nulla suscipit ligula in lacus
Kellogs Special K Cereal,elit proin risus praesent lectus vestibulum quam sapien varius ut blandit non interdum
"Pasta - Shells, Medium, Dry",vestibulum eget vulputate ut ultrices vel augue vestibulum ante ipsum primis in
Carbonated Water - Orange,tempus vel pede morbi porttitor lorem id ligula suspendisse ornare consequat lectus in est risus auctor sed tristique in tempus
Arrowroot,tristique est et tempus semper est quam pharetra magna ac consequat metus
"Rum - Light, Captain Morgan",eget tempus vel pede morbi porttitor lorem id ligula suspendisse ornare consequat lectus in est risus auctor
Bulgar,potenti in eleifend quam a odio in hac habitasse platea dictumst
Sprouts - China Rose,suscipit a feugiat et eros vestibulum ac est lacinia nisi venenatis tristique fusce congue diam id
Dried Peach,amet cursus id turpis integer aliquet massa id lobortis convallis tortor risus dapibus augue
Energy Drink - Franks Original,est quam pharetra magna ac consequat metus sapien ut nunc vestibulum ante ipsum
Bread - Bistro Sour,ut mauris eget massa tempor convallis nulla neque libero convallis eget eleifend
True - Vue Containers,libero rutrum ac lobortis vel dapibus at diam nam tristique
Soup - Base Broth Beef,nullam molestie nibh in lectus pellentesque at nulla suspendisse potenti
Bread Ww Cluster,id sapien in sapien iaculis congue vivamus metus arcu adipiscing molestie hendrerit at vulputate vitae nisl aenean lectus
Orange Roughy 4/6 Oz,in felis eu sapien cursus vestibulum proin eu mi nulla
"Soup - Campbells, Cream Of",aliquet maecenas leo odio condimentum id luctus nec molestie sed justo
Snapple Raspberry Tea,elementum nullam varius nulla facilisi cras non velit nec nisi vulputate nonummy maecenas tincidunt lacus at velit vivamus vel
Currants,ultrices aliquet maecenas leo odio condimentum id luctus nec molestie sed justo pellentesque
Bay Leaf Fresh,aliquam convallis nunc proin at turpis a pede posuere nonummy integer non velit donec diam neque vestibulum eget vulputate ut
Sausage - Blood Pudding,mus vivamus vestibulum sagittis sapien cum sociis natoque penatibus et magnis dis parturient montes nascetur ridiculus mus etiam vel
Cheese - Cheddarsliced,viverra pede ac diam cras pellentesque volutpat dui maecenas tristique est et tempus semper est quam pharetra magna
"Salmon - Whole, 4 - 6 Pounds",vestibulum sed magna at nunc commodo placerat praesent blandit nam nulla integer pede
"Marsala - Sperone, Fine, D.o.c.",sit amet eros suspendisse accumsan tortor quis turpis sed ante vivamus tortor duis mattis egestas metus aenean fermentum donec
Capers - Pickled,diam vitae quam suspendisse potenti nullam porttitor lacus at turpis donec posuere metus vitae ipsum aliquam non
"Jam - Raspberry,jar",vulputate luctus cum sociis natoque penatibus et magnis dis parturient montes nascetur ridiculus mus
"Artichoke - Hearts, Canned",accumsan tellus nisi eu orci mauris lacinia sapien quis libero nullam sit amet turpis elementum ligula vehicula consequat
Ice Cream Bar - Rolo Cone,tellus nisi eu orci mauris lacinia sapien quis libero nullam
"Pasta - Rotini, Dry",blandit non interdum in ante vestibulum ante ipsum primis in faucibus orci
Lettuce - Treviso,vel lectus in quam fringilla rhoncus mauris enim leo rhoncus sed vestibulum sit amet
Sugar - Monocystal / Rock,porta volutpat quam pede lobortis ligula sit amet eleifend pede libero quis orci nullam molestie nibh in lectus pellentesque at
Whmis Spray Bottle Graduated,consectetuer adipiscing elit proin interdum mauris non ligula pellentesque ultrices phasellus id sapien in sapien iaculis congue vivamus metus
"Juice - Orange, Concentrate",ligula pellentesque ultrices phasellus id sapien in sapien iaculis congue vivamus metus arcu adipiscing molestie hendrerit at vulputate vitae
Swordfish Loin Portions,vestibulum eget vulputate ut ultrices vel augue vestibulum ante ipsum primis in faucibus orci luctus et
"Flour - Corn, Fine",enim in tempor turpis nec euismod scelerisque quam turpis adipiscing lorem
Cup - 8oz Coffee Perforated,ultrices enim lorem ipsum dolor sit amet consectetuer adipiscing elit proin interdum mauris
Durian Fruit,primis in faucibus orci luctus et ultrices posuere cubilia curae mauris viverra diam vitae quam suspendisse potenti nullam porttitor
Flour - Teff,ut nulla sed accumsan felis ut at dolor quis odio consequat varius integer ac leo pellentesque
Kahlua,phasellus sit amet erat nulla tempus vivamus in felis eu sapien cursus vestibulum proin eu mi nulla ac enim
Shrimp - 31/40,pellentesque ultrices mattis odio donec vitae nisi nam ultrices libero
"Beans - Turtle, Black, Dry",sit amet turpis elementum ligula vehicula consequat morbi a ipsum integer a nibh in quis justo
Lettuce - Sea / Sea Asparagus,tellus nisi eu orci mauris lacinia sapien quis libero nullam
Eggwhite Frozen,donec semper sapien a libero nam dui proin leo odio
Mushroom - Lg - Cello,justo lacinia eget tincidunt eget tempus vel pede morbi porttitor lorem
"Tomatoes - Vine Ripe, Yellow",dictumst aliquam augue quam sollicitudin vitae consectetuer eget rutrum at lorem integer tincidunt ante vel ipsum praesent blandit lacinia
Chips Potato Salt Vinegar 43g,lorem vitae mattis nibh ligula nec sem duis aliquam convallis nunc proin at turpis
Table Cloth 54x54 Colour,sit amet nulla quisque arcu libero rutrum ac lobortis vel dapibus at diam nam tristique tortor
Coconut Milk - Unsweetened,orci luctus et ultrices posuere cubilia curae donec pharetra magna vestibulum
Cape Capensis - Fillet,odio porttitor id consequat in consequat ut nulla sed accumsan felis ut at dolor quis odio consequat varius integer
Pepperoni Slices,consectetuer adipiscing elit proin risus praesent lectus vestibulum quam sapien varius ut blandit non interdum
Crab - Imitation Flakes,arcu adipiscing molestie hendrerit at vulputate vitae nisl aenean lectus pellentesque eget nunc donec quis orci
Sprouts - Alfalfa,quis orci nullam molestie nibh in lectus pellentesque at nulla
Anchovy In Oil,vestibulum sed magna at nunc commodo placerat praesent blandit nam nulla integer pede justo lacinia eget tincidunt
Sprouts - Brussel,in tempus sit amet sem fusce consequat nulla nisl nunc nisl duis bibendum
Sauce - Plum,consequat dui nec nisi volutpat eleifend donec ut dolor morbi
Chicken - Tenderloin,congue diam id ornare imperdiet sapien urna pretium nisl ut volutpat sapien
Pastry - Apple Large,in faucibus orci luctus et ultrices posuere cubilia curae mauris viverra diam
Wine - Placido Pinot Grigo,sit amet nunc viverra dapibus nulla suscipit ligula in lacus curabitur
"Crush - Grape, 355 Ml",sapien iaculis congue vivamus metus arcu adipiscing molestie hendrerit at vulputate vitae nisl aenean lectus pellentesque eget nunc donec
Nut - Macadamia,at velit eu est congue elementum in hac habitasse platea dictumst morbi vestibulum velit
Lettuce - Belgian Endive,porta volutpat erat quisque erat eros viverra eget congue eget semper rutrum
"Capon - Breast, Double, Wing On",sem sed sagittis nam congue risus semper porta volutpat quam pede lobortis
"Orange - Canned, Mandarin",aenean fermentum donec ut mauris eget massa tempor convallis nulla
Sugar - Palm,enim leo rhoncus sed vestibulum sit amet cursus id turpis
Tequila Rose Cream Liquor,feugiat et eros vestibulum ac est lacinia nisi venenatis tristique fusce congue diam id ornare imperdiet
"Glass - Wine, Plastic, Clear 5 Oz",egestas metus aenean fermentum donec ut mauris eget massa tempor convallis nulla neque libero convallis eget eleifend luctus ultricies eu
Chicken - Ground,montes nascetur ridiculus mus etiam vel augue vestibulum rutrum rutrum
"Yogurt - Blueberry, 175 Gr",commodo placerat praesent blandit nam nulla integer pede justo lacinia eget tincidunt eget tempus vel
Wine - Remy Pannier Rose,praesent blandit lacinia erat vestibulum sed magna at nunc commodo placerat praesent blandit nam nulla
Beef - Montreal Smoked Brisket,in faucibus orci luctus et ultrices posuere cubilia curae nulla dapibus dolor vel est donec odio justo sollicitudin ut
Sherry - Dry,integer ac leo pellentesque ultrices mattis odio donec vitae nisi nam ultrices libero
Muffins - Assorted,et commodo vulputate justo in blandit ultrices enim lorem ipsum dolor sit amet consectetuer adipiscing elit
Table Cloth 54x72 White,urna ut tellus nulla ut erat id mauris vulputate elementum nullam varius nulla facilisi cras non velit
Cake - Sheet Strawberry,faucibus orci luctus et ultrices posuere cubilia curae nulla dapibus dolor vel est donec odio justo sollicitudin
Ezy Change Mophandle,sem duis aliquam convallis nunc proin at turpis a pede posuere nonummy integer non velit donec diam neque vestibulum
Squid - Breaded,molestie nibh in lectus pellentesque at nulla suspendisse potenti cras in purus eu magna
Anchovy Fillets,quis turpis eget elit sodales scelerisque mauris sit amet eros suspendisse accumsan tortor quis turpis
Cheese - Le Cheve Noir,nisi eu orci mauris lacinia sapien quis libero nullam sit amet turpis elementum ligula vehicula consequat
Bay Leaf Ground,vitae nisl aenean lectus pellentesque eget nunc donec quis orci eget orci vehicula condimentum curabitur
Longos - Greek Salad,diam id ornare imperdiet sapien urna pretium nisl ut volutpat sapien arcu sed augue aliquam erat volutpat in
Crush - Cream Soda,sapien urna pretium nisl ut volutpat sapien arcu sed augue aliquam erat volutpat in
Wine - Rosso Toscano Igt,feugiat non pretium quis lectus suspendisse potenti in eleifend quam a odio
Longos - Grilled Chicken With,sed interdum venenatis turpis enim blandit mi in porttitor pede justo eu massa donec dapibus
Watercress,vehicula consequat morbi a ipsum integer a nibh in quis justo maecenas rhoncus aliquam lacus morbi quis tortor id nulla
Wine - Kwv Chenin Blanc South,fermentum justo nec condimentum neque sapien placerat ante nulla justo aliquam quis turpis
Table Cloth 62x114 White,vulputate justo in blandit ultrices enim lorem ipsum dolor sit amet consectetuer
Cheese - Provolone,justo eu massa donec dapibus duis at velit eu est congue elementum in hac habitasse platea dictumst morbi vestibulum
Appetizer - Sausage Rolls,congue diam id ornare imperdiet sapien urna pretium nisl ut volutpat sapien arcu sed augue aliquam erat volutpat in
Garam Marsala,morbi porttitor lorem id ligula suspendisse ornare consequat lectus in est risus auctor sed tristique in tempus sit amet
Beer - Corona,sem duis aliquam convallis nunc proin at turpis a pede posuere nonummy
Olives - Kalamata,neque aenean auctor gravida sem praesent id massa id nisl venenatis lacinia aenean sit amet
"Chicken - Thigh, Bone In",luctus et ultrices posuere cubilia curae donec pharetra magna vestibulum aliquet ultrices erat tortor sollicitudin mi sit amet lobortis
Cheese - Marble,velit vivamus vel nulla eget eros elementum pellentesque quisque porta volutpat erat
Wine - Red Oakridge Merlot,mauris eget massa tempor convallis nulla neque libero convallis eget eleifend luctus ultricies eu nibh quisque id justo
"Mushroom - Shitake, Dry",cum sociis natoque penatibus et magnis dis parturient montes nascetur ridiculus mus etiam vel augue vestibulum rutrum rutrum
Tea - Apple Green Tea,ullamcorper purus sit amet nulla quisque arcu libero rutrum ac lobortis vel
Sansho Powder,nulla neque libero convallis eget eleifend luctus ultricies eu nibh quisque id justo
Beer - Rickards Red,diam erat fermentum justo nec condimentum neque sapien placerat ante nulla justo aliquam quis turpis
Brandy Cherry - Mcguinness,primis in faucibus orci luctus et ultrices posuere cubilia curae nulla dapibus dolor vel
"Pesto - Primerba, Paste",cras mi pede malesuada in imperdiet et commodo vulputate justo in blandit ultrices enim
Molasses - Fancy,eget nunc donec quis orci eget orci vehicula condimentum curabitur in libero ut massa volutpat convallis
Pork - Smoked Kassler,tortor quis turpis sed ante vivamus tortor duis mattis egestas metus aenean fermentum donec ut mauris eget massa
"Radish - Black, Winter, Organic",purus aliquet at feugiat non pretium quis lectus suspendisse potenti in eleifend quam a odio in hac
Kaffir Lime Leaves,massa quis augue luctus tincidunt nulla mollis molestie lorem quisque ut erat curabitur gravida
Ginger - Crystalized,luctus et ultrices posuere cubilia curae donec pharetra magna vestibulum
Chocolate Bar - Smarties,ullamcorper augue a suscipit nulla elit ac nulla sed vel enim sit amet nunc viverra dapibus nulla
Pepper - Red Thai,non sodales sed tincidunt eu felis fusce posuere felis sed lacus
"Beef - Chuck, Boneless",aenean fermentum donec ut mauris eget massa tempor convallis nulla neque libero convallis eget eleifend luctus ultricies
Wine - Zinfandel Rosenblum,quisque erat eros viverra eget congue eget semper rutrum nulla nunc purus phasellus in felis donec semper sapien a
"Wine - Red, Harrow Estates, Cab",vestibulum ante ipsum primis in faucibus orci luctus et ultrices posuere cubilia curae duis faucibus accumsan odio curabitur
Trueblue - Blueberry Cranberry,tincidunt nulla mollis molestie lorem quisque ut erat curabitur gravida nisi at
Energy Drink Red Bull,justo pellentesque viverra pede ac diam cras pellentesque volutpat dui maecenas tristique est et
Berry Brulee,urna ut tellus nulla ut erat id mauris vulputate elementum nullam varius nulla facilisi cras non
Bamboo Shoots - Sliced,volutpat convallis morbi odio odio elementum eu interdum eu tincidunt in leo maecenas pulvinar lobortis
Mushroom Morel Fresh,ut blandit non interdum in ante vestibulum ante ipsum primis
"Carrots - Mini, Stem On",eget semper rutrum nulla nunc purus phasellus in felis donec semper sapien a libero nam dui proin leo
Corn - Mini,dictumst morbi vestibulum velit id pretium iaculis diam erat fermentum
Wine - White Cab Sauv.on,nunc vestibulum ante ipsum primis in faucibus orci luctus et ultrices posuere cubilia curae mauris viverra diam vitae
Flour Dark Rye,tincidunt lacus at velit vivamus vel nulla eget eros elementum pellentesque quisque porta
Napkin - Beverage 1 Ply,sapien arcu sed augue aliquam erat volutpat in congue etiam justo etiam pretium iaculis justo in hac
"Pasta - Penne, Rigate, Dry",semper sapien a libero nam dui proin leo odio porttitor id consequat in consequat ut
Lid Tray - 12in Dome,bibendum imperdiet nullam orci pede venenatis non sodales sed tincidunt eu
Flavouring - Rum,vitae consectetuer eget rutrum at lorem integer tincidunt ante vel ipsum praesent blandit lacinia erat vestibulum sed magna
Wine - Sawmill Creek Autumn,at nibh in hac habitasse platea dictumst aliquam augue quam sollicitudin
"Corn - Cream, Canned",volutpat erat quisque erat eros viverra eget congue eget semper rutrum nulla nunc purus phasellus in felis donec semper
Lamb - Ground,lacinia erat vestibulum sed magna at nunc commodo placerat praesent blandit nam nulla integer pede justo lacinia eget
Ham Black Forest,accumsan odio curabitur convallis duis consequat dui nec nisi volutpat eleifend donec
Pepper - Cayenne,in faucibus orci luctus et ultrices posuere cubilia curae nulla dapibus dolor vel est donec odio justo
"Carrots - Purple, Organic",ut erat id mauris vulputate elementum nullam varius nulla facilisi cras non velit
Spice - Chili Powder Mexican,tortor sollicitudin mi sit amet lobortis sapien sapien non mi
Melon - Honey Dew,auctor sed tristique in tempus sit amet sem fusce consequat nulla nisl nunc
Pork - Back Ribs,vel ipsum praesent blandit lacinia erat vestibulum sed magna at nunc commodo placerat praesent blandit nam nulla
Grouper - Fresh,sed augue aliquam erat volutpat in congue etiam justo etiam pretium iaculis justo in
Salmon Steak - Cohoe 8 Oz,nullam molestie nibh in lectus pellentesque at nulla suspendisse potenti cras in purus eu magna vulputate luctus cum sociis natoque
Energy Drink Red Bull,integer ac neque duis bibendum morbi non quam nec dui luctus rutrum nulla tellus in sagittis dui vel
Langers - Mango Nectar,velit id pretium iaculis diam erat fermentum justo nec condimentum
Squash - Pepper,ac diam cras pellentesque volutpat dui maecenas tristique est et tempus semper est quam pharetra magna ac
"Wine - White, French Cross",ut at dolor quis odio consequat varius integer ac leo pellentesque ultrices mattis odio donec
Wine - Two Oceans Cabernet,ante ipsum primis in faucibus orci luctus et ultrices posuere
Table Cloth 54x54 White,tristique fusce congue diam id ornare imperdiet sapien urna pretium
Pie Shell - 9,luctus ultricies eu nibh quisque id justo sit amet sapien dignissim vestibulum vestibulum
"Soup - Beef Conomme, Dry",quam sapien varius ut blandit non interdum in ante vestibulum ante ipsum primis
"Mushrooms - Black, Dried",at ipsum ac tellus semper interdum mauris ullamcorper purus sit
Muffin Hinge 117n,bibendum felis sed interdum venenatis turpis enim blandit mi in porttitor pede justo eu massa donec dapibus
Lettuce - Curly Endive,quis lectus suspendisse potenti in eleifend quam a odio in hac
Versatainer Nc - 888,justo morbi ut odio cras mi pede malesuada in imperdiet et
Pizza Pizza Dough,at velit eu est congue elementum in hac habitasse platea dictumst morbi vestibulum velit id pretium iaculis
Bacardi Breezer - Strawberry,rutrum at lorem integer tincidunt ante vel ipsum praesent blandit lacinia erat vestibulum sed magna at nunc commodo
Muffin - Banana Nut Individual,mauris sit amet eros suspendisse accumsan tortor quis turpis sed ante vivamus
"Asparagus - Green, Fresh",quam sapien varius ut blandit non interdum in ante vestibulum ante ipsum primis in
Milkettes - 2%,tincidunt lacus at velit vivamus vel nulla eget eros elementum pellentesque quisque
Canadian Emmenthal,vitae nisl aenean lectus pellentesque eget nunc donec quis orci eget orci vehicula condimentum curabitur in libero ut
"Pork - Tenderloin, Frozen",volutpat erat quisque erat eros viverra eget congue eget semper rutrum nulla
Squid U5 - Thailand,at velit eu est congue elementum in hac habitasse platea dictumst morbi vestibulum velit id
Potatoes - Pei 10 Oz,lobortis sapien sapien non mi integer ac neque duis bibendum
Beef - Ox Tongue,vivamus metus arcu adipiscing molestie hendrerit at vulputate vitae nisl aenean lectus pellentesque eget nunc donec quis orci eget orci
"Fish - Scallops, Cold Smoked",rutrum nulla tellus in sagittis dui vel nisl duis ac
Beer - Molson Excel,vel sem sed sagittis nam congue risus semper porta volutpat quam pede lobortis ligula
Bar - Sweet And Salty Chocolate,sed magna at nunc commodo placerat praesent blandit nam nulla integer
Cookie Trail Mix,nibh in lectus pellentesque at nulla suspendisse potenti cras in purus eu magna vulputate
Chocolate Liqueur - Godet White,in quis justo maecenas rhoncus aliquam lacus morbi quis tortor id nulla ultrices aliquet
Pork - Kidney,nec dui luctus rutrum nulla tellus in sagittis dui vel nisl duis ac nibh fusce lacus purus aliquet at
Apricots - Dried,vestibulum ante ipsum primis in faucibus orci luctus et ultrices posuere cubilia curae duis faucibus accumsan odio curabitur convallis duis
Irish Cream - Baileys,dui nec nisi volutpat eleifend donec ut dolor morbi vel lectus in quam fringilla rhoncus mauris enim leo rhoncus
Shrimp - Black Tiger 16/20,dui vel sem sed sagittis nam congue risus semper porta
Vinegar - Raspberry,tincidunt ante vel ipsum praesent blandit lacinia erat vestibulum sed magna at nunc commodo placerat
Lamb - Shoulder,erat tortor sollicitudin mi sit amet lobortis sapien sapien non
"Chestnuts - Whole,canned",nec condimentum neque sapien placerat ante nulla justo aliquam quis turpis eget elit sodales scelerisque
Lid Coffeecup 12oz D9542b,mattis nibh ligula nec sem duis aliquam convallis nunc proin at turpis a pede posuere nonummy integer non velit donec
"Pasta - Penne, Rigate, Dry",eget eleifend luctus ultricies eu nibh quisque id justo sit amet sapien dignissim vestibulum vestibulum ante ipsum
Sugar - Fine,pellentesque eget nunc donec quis orci eget orci vehicula condimentum curabitur in libero ut massa volutpat
Pepsi - 600ml,non mattis pulvinar nulla pede ullamcorper augue a suscipit nulla
Bagel - Plain,nulla elit ac nulla sed vel enim sit amet nunc viverra
Bar - Sweet And Salty Chocolate,purus eu magna vulputate luctus cum sociis natoque penatibus et magnis
Cheese - Le Cru Du Clocher,nisl aenean lectus pellentesque eget nunc donec quis orci eget orci vehicula condimentum curabitur
"Arctic Char - Fresh, Whole",curae nulla dapibus dolor vel est donec odio justo sollicitudin ut suscipit a feugiat et eros vestibulum ac est
Trout Rainbow Whole,aliquam lacus morbi quis tortor id nulla ultrices aliquet maecenas leo
Wheat - Soft Kernal Of Wheat,hac habitasse platea dictumst aliquam augue quam sollicitudin vitae consectetuer eget rutrum at lorem integer tincidunt ante vel ipsum praesent
"Lid - 10,12,16 Oz",praesent blandit nam nulla integer pede justo lacinia eget tincidunt eget tempus
Wine - Duboeuf Beaujolais,lorem integer tincidunt ante vel ipsum praesent blandit lacinia erat vestibulum sed
Bay Leaf Ground,nulla eget eros elementum pellentesque quisque porta volutpat erat quisque erat eros viverra eget congue eget semper rutrum nulla
Sorrel - Fresh,justo in blandit ultrices enim lorem ipsum dolor sit amet consectetuer adipiscing elit proin interdum mauris non
Nori Sea Weed - Gold Label,nisi vulputate nonummy maecenas tincidunt lacus at velit vivamus vel nulla
Cake - Box Window 10x10x2.5,nunc rhoncus dui vel sem sed sagittis nam congue risus semper porta volutpat quam pede lobortis ligula sit amet
"Red Snapper - Fillet, Skin On",aenean fermentum donec ut mauris eget massa tempor convallis nulla neque
Cheese - Swiss,in hac habitasse platea dictumst aliquam augue quam sollicitudin vitae consectetuer eget rutrum at lorem integer tincidunt ante
"Bread - Pita, Mini",condimentum curabitur in libero ut massa volutpat convallis morbi odio odio elementum eu
Tahini Paste,primis in faucibus orci luctus et ultrices posuere cubilia curae nulla dapibus dolor vel est donec
Pork - Belly Fresh,mi integer ac neque duis bibendum morbi non quam nec dui luctus rutrum nulla
Pancetta,quam sollicitudin vitae consectetuer eget rutrum at lorem integer tincidunt ante vel ipsum praesent blandit
Cookie - Oatmeal,rutrum nulla tellus in sagittis dui vel nisl duis ac
Bar Energy Chocchip,consequat metus sapien ut nunc vestibulum ante ipsum primis in faucibus orci luctus
Wine - Gato Negro Cabernet,interdum in ante vestibulum ante ipsum primis in faucibus orci luctus et ultrices posuere cubilia curae duis
Bread - White Mini Epi,blandit lacinia erat vestibulum sed magna at nunc commodo placerat praesent blandit nam nulla
"Chicken - White Meat, No Tender",sodales sed tincidunt eu felis fusce posuere felis sed lacus morbi sem mauris laoreet ut rhoncus aliquet pulvinar
Tarts Assorted,amet consectetuer adipiscing elit proin risus praesent lectus vestibulum quam sapien
Pork Salted Bellies,faucibus orci luctus et ultrices posuere cubilia curae mauris viverra diam vitae
Chickensplit Half,penatibus et magnis dis parturient montes nascetur ridiculus mus vivamus vestibulum sagittis sapien cum sociis natoque penatibus et magnis dis
"Pasta - Gnocchi, Potato",lorem quisque ut erat curabitur gravida nisi at nibh in hac habitasse platea
Lemon Tarts,nulla suscipit ligula in lacus curabitur at ipsum ac tellus semper interdum mauris ullamcorper purus sit amet nulla quisque
Flavouring - Orange,nunc viverra dapibus nulla suscipit ligula in lacus curabitur at ipsum ac tellus semper interdum
Pepper - Orange,pellentesque ultrices mattis odio donec vitae nisi nam ultrices libero non mattis pulvinar
Frangelico,nullam varius nulla facilisi cras non velit nec nisi vulputate nonummy maecenas tincidunt lacus at
Dragon Fruit,dui vel nisl duis ac nibh fusce lacus purus aliquet at feugiat non pretium
Cake - Mini Cheesecake,orci luctus et ultrices posuere cubilia curae duis faucibus accumsan odio
Pumpkin - Seed,faucibus orci luctus et ultrices posuere cubilia curae duis faucibus accumsan odio curabitur convallis duis
Ice Cream Bar - Oreo Cone,est congue elementum in hac habitasse platea dictumst morbi vestibulum velit id pretium iaculis
Smirnoff Green Apple Twist,nisl aenean lectus pellentesque eget nunc donec quis orci eget orci vehicula condimentum curabitur in libero
"Juice - Tomato, 48 Oz",nunc nisl duis bibendum felis sed interdum venenatis turpis enim blandit
Lettuce - Arugula,libero non mattis pulvinar nulla pede ullamcorper augue a suscipit nulla elit
Bread - Corn Muffaleta Onion,vestibulum sagittis sapien cum sociis natoque penatibus et magnis dis parturient montes nascetur ridiculus mus etiam vel augue vestibulum
Sauce - Balsamic Viniagrette,lobortis sapien sapien non mi integer ac neque duis bibendum morbi non quam nec
Skewers - Bamboo,felis ut at dolor quis odio consequat varius integer ac leo pellentesque ultrices mattis odio
Star Fruit,nec euismod scelerisque quam turpis adipiscing lorem vitae mattis nibh
Fennel - Seeds,justo eu massa donec dapibus duis at velit eu est congue
Soup - Campbells Mac N Cheese,maecenas pulvinar lobortis est phasellus sit amet erat nulla tempus vivamus in felis eu sapien cursus vestibulum proin eu
Bread - Italian Roll With Herbs,duis consequat dui nec nisi volutpat eleifend donec ut dolor morbi vel lectus in quam fringilla rhoncus
Wild Boar - Tenderloin,velit id pretium iaculis diam erat fermentum justo nec condimentum
